name,organization,homepage,logo,twitter,crunchbase_url,funding,member,relation,tag,license,headquarters,description,crunchbase_description,crunchbase_homepage,crunchbase_city,crunchbase_region,crunchbase_country,crunchbase_twitter,crunchbase_linkedin,crunchbase_ticker,crunchbase_kind,crunchbase_min_employees,crunchbase_max_employees,category,subcategory,oss,github_repo,github_stars,github_description,github_latest_commit_date,github_latest_commit_link,github_latest_release_date,github_latest_release_link,github_start_commit_date,github_start_commit_link,github_contributors_count,github_contributors_link,accepted,incubation,graduated,dev_stats_url,artwork_url,blog_url,mailing_list_url,slack_url,youtube_url,chat_channel,last_audit_date,last_audit_url
Eclipse ADAAA (Adaptive Cruise Control Demo Application for Adaptive AUTOSAR),,https://projects.eclipse.org/projects/automotive.adaaa,logos/659e2f70be525eba2aab44801cf938957fba27e876a66937af6956f883dcbd24.png,,,,,Archived,,,,"ADAAA is example application for Adaptive AUTOSAR with the following goals:
* Provide a tutorial with simple examples code base for getting involved with AUTOSAR methodology and each functional...",,,,,,,,,,,,Example Applications,Example Applications,,,,,,,,,,,,,,,,,,,,,,,,
Eclipse Ambient Light Services,,https://projects.eclipse.org/projects/automotive.ambientlight,logos/14738f70197e197d29160180e7340a4d992966689c34c71d272d812d336b7024.png,,,,,Incubating,,,,"The Eclipse Ambient Light Services showcase vizualizes possible new lighting concepts which are adaptive to different specific driving scenarios, like e.g. coming and leaving but also further options...",,,,,,,,,,,,Example Applications,Example Applications,,,,,,,,,,,,,,,,,,,,,,,,
Eclipse Ankaios,,https://projects.eclipse.org/projects/automotive.ankaios,logos/59967f26cdd2c6c78898999eb28d82db8394d22580335d53a467236abecac6ad.png,,,,,Incubating,,,,"Eclipse Ankaios manages multiple nodes and virtual machines with a single unique API in order to start, stop, configure, and update containers and workloads. It provides a central place to manage...",,,,,,,,,,,,Runtime and Orchestration,Workload & Container Orchestration,,,,,,,,,,,,,,,,,,,,,,,,
Eclipse ArchE,,https://projects.eclipse.org/projects/automotive.arche,logos/9bc15ce9cdf3d9cbbafd846257169d526abc4d96e75ac7c0c45cdd036be1993d.png,,,,,Incubating,,,,Eclipse ArchE (Architecture Enabler) provides a tool for Architecture Modeling following an holistic Model-Based-Systems-Engineering (MBSE) approach instead of having a heterogeneous environment of...,,,,,,,,,,,,Tooling Devops,Design,,,,,,,,,,,,,,,,,,,,,,,,
Eclipse Automotive API Framework,,https://projects.eclipse.org/projects/automotive.autoapiframework,logos/47d5b8302afff5fd05c429e32bc989d8151da028f02eb30075b3462d68267af0.png,,,,,Incubating,,,,Decoupling of the application logic from the basic software stack enables automotive suppliers (no matter if Tier-1 or in-house teams at an OEM) to contribute with building blocks to Software-defined...,,,,,,,,,,,,Distributions and Frameworks,Distributions,,,,,,,,,,,,,,,,,,,,,,,,
Eclipse Automotive Integration for AutoSD,,https://projects.eclipse.org/projects/automotive.autosd,logos/14738f70197e197d29160180e7340a4d992966689c34c71d272d812d336b7024.png,,,,,Incubating,,,,"Eclipse Automotive Integration for AutoSD uses an AutoSD image, built and tailored for its community, to run and test both Eclipse SDV projects and blueprints.
Eclipse Automotive Integration for...",,,,,,,,,,,,Distributions and Frameworks,Distributions,,,,,,,,,,,,,,,,,,,,,,,,
Eclipse Autowrx,,https://projects.eclipse.org/projects/automotive.autowrx,logos/14738f70197e197d29160180e7340a4d992966689c34c71d272d812d336b7024.png,,,,,Incubating,,,,"Eclipse Autowrx is the open source implementation of digital.auto (http://digital.auto), an industry-wide initiative enabling the automotive industry to establish a new, digital-first approach for the...",,,,,,,,,,,,Tooling Devops,Development,,,,,,,,,,,,,,,,,,,,,,,,
Eclipse Backend function Bindings (BfB),,https://projects.eclipse.org/projects/automotive.bfb,logos/659e2f70be525eba2aab44801cf938957fba27e876a66937af6956f883dcbd24.png,,,,,Archived,,,,"The Eclipse BfB project provides a protocol and technology agnostic interface specification in the ecosystem of mobility and automotive applications.
The Eclipse BfB specification is maintained in a...",,,,,,,,,,,,Unmapped,Misc,,,,,,,,,,,,,,,,,,,,,,,,
Eclipse BlueChi™,,https://projects.eclipse.org/projects/automotive.bluechi,logos/4feb8479d22c1b395bb9d9100918ddbc3518ce54859d1b8f86c7aa4ad095d2e2.png,,,,,Regular,,,,Eclipse BlueChi™ is a deterministic multi-node service controller with a focus on highly regulated ecosystems. It is written in C and integrates seamless with systemd via its D-Bus API relaying D-Bus...,,,,,,,,,,,,Runtime and Orchestration,Workload & Container Orchestration,,,,,,,,,,,,,,,,,,,,,,,,
Eclipse CANought,,https://projects.eclipse.org/projects/iot.kanto.canought,logos/14738f70197e197d29160180e7340a4d992966689c34c71d272d812d336b7024.png,,,,,Incubating,,,,Eclipse CANought offers the automotive-specific capabilities to enhance the Eclipse Kanto project to offer a comprehensive solution focused on the automotive industry. Eclipse CANought provides...,,,,,,,,,,,,Service Fabric and Communication,Communication Protocols,,,,,,,,,,,,,,,,,,,,,,,,
Eclipse Chariott,,https://projects.eclipse.org/projects/automotive.chariott,logos/e0c42b6c6fdd4dabb16c5543c80f0375cadb2e2e6dbc1f367fe42c300092f548.jpg,,,,,Incubating,,,,The Eclipse Chariott project aims to simplify and enhance in-vehicle software developer productivity by providing a metadata-driven middleware/abstraction layer that allows modern application...,,,,,,,,,,,,Service Fabric and Communication,Middleware & Frameworks,,,,,,,,,,,,,,,,,,,,,,,,
Eclipse eCAL (enhanced Communication Abstraction Layer),,https://projects.eclipse.org/projects/automotive.ecal,logos/70cdb05cfc52346f38325c450aed9c99420c632ca7a1e748bd8897e961f03639.png,,,,,Incubating,,,,"Eclipse eCAL™ (enhanced Communication Abstraction Layer) provides a middleware that enables scalable, high performance interprocess communication on a single computer node or between different nodes...",,,,,,,,,,,,Service Fabric and Communication,Middleware & Frameworks,,,,,,,,,,,,,,,,,,,,,,,,
Eclipse Heimlig,,https://projects.eclipse.org/projects/automotive.heimlig,logos/14738f70197e197d29160180e7340a4d992966689c34c71d272d812d336b7024.png,,,,,Incubating,,,,"Eclipse Heimlig is a Hardware Security Module (HSM) firmware for embedded platforms written in Rust.
As an HSM, Eclipse Heimlig typically runs on dedicated hardware and provides cryptographic services...",,,,,,,,,,,,Service Fabric and Communication,Middleware & Frameworks,,,,,,,,,,,,,,,,,,,,,,,,
Eclipse Ibeji,,https://projects.eclipse.org/projects/automotive.ibeji,logos/2e9611f9be59b79424d3334d84e7e8f56f0936ce00f535d5976c21a8646d0fe6.png,,,,,Incubating,,,,The automotive and mobility ecosystem is facing major challenges in modernizing and streamlining in-vehicle software development as well as in software life cycle management. The Eclipse Ibeji project...,,,,,,,,,,,,Service Fabric and Communication,Digital Twin,,,,,,,,,,,,,,,,,,,,,,,,
Eclipse iceoryx,,https://projects.eclipse.org/projects/technology.iceoryx,logos/5ea595e0b5ffbe37ee573ff812074c6c77a4873857348d82656f247f6ff10e72.png,,,,,Regular,,,,"In domains like automotive, robotics or gaming, a huge amount of data must be transferred between different parts of the system. If these parts are actually different processes on a POSIX based...",,,,,,,,,,,,Service Fabric and Communication,Communication Protocols,,,,,,,,,,,,,,,,,,,,,,,,
Eclipse Kuksa,,https://projects.eclipse.org/projects/automotive.kuksa,logos/f10feb1e4b831406f889e37c94873512c3bf4b8548630fe013b54a9aede77155.png,,,,,Incubating,,,,"Eclipse KUKSA provides the essential data orchestration layer for the modern Software Defined Vehicle (SDV) ecosystem. It acts as the ""connective tissue"" between a vehicle’s complex hardware sensors...",,,,,,,,,,,,Service Fabric and Communication,Middleware & Frameworks,,,,,,,,,,,,,,,,,,,,,,,,
Eclipse Leda,,https://projects.eclipse.org/projects/automotive.leda,logos/2f0b05965555c6df26b2a9a06279e0294f016c670f75abb37fa80eb7adfc9c6d.png,,,,,Incubating,,,,"In the ambition to build a technology ecosystem for software-defined vehicle, one of the main challengs will be the combination of the diverse components into a coherent and useful whole: all the...",,,,,,,,,,,,Distributions and Frameworks,Distributions,,,,,,,,,,,,,,,,,,,,,,,,
Eclipse Leda Incubator,,https://projects.eclipse.org/projects/automotive.leda.ledaincubator,logos/14738f70197e197d29160180e7340a4d992966689c34c71d272d812d336b7024.png,,,,,Incubating,,,,Eclipse Leda Incubator provides a place for experimental components from the software-defined vehicle ecosystem.,,,,,,,,,,,,Distributions and Frameworks,Distributions,,,,,,,,,,,,,,,,,,,,,,,,
Eclipse LMOS,,https://projects.eclipse.org/projects/technology.lmos,logos/8abfb24af6b0aada8c08cf2bef23145a233b888a9a23b68e1bd77f91e50f2b3e.png,,,,,Incubating,,,,The Eclipse LMOS project (Language Model Operating System) is essentially a platform for building and running AI systems that can handle complex tasks. Imagine it like an operating system for your...,,,,,,,,,,,,AI,AI,,,,,,,,,,,,,,,,,,,,,,,,
Eclipse MoEc,,https://projects.eclipse.org/projects/automotive.moec,logos/659e2f70be525eba2aab44801cf938957fba27e876a66937af6956f883dcbd24.png,,,,,Archived,,,,"Eclipse MoEc provides an open software development kit (SDK) for infrastructure-based planning, motion, parking and charging solutions within the Software Defined Vehicle (SDV) ecosystem.
The MoEc SDK...",,,,,,,,,,,,Unmapped,Misc,,,,,,,,,,,,,,,,,,,,,,,,
Eclipse Muto,,https://projects.eclipse.org/projects/automotive.muto,logos/c52d3ca98bc70e52625611c9c3f27e7e3350eba9705265e1bc91338d8db8b089.png,,,,,Incubating,,,,"Eclipse Muto provides an adaptive framework and a runtime platform for dynamically composable model-driven ROS software stacks. Eclipse Muto can be used  to introspect, monitor and manipulate the...",,,,,,,,,,,,Tooling Devops,Deployment,,,,,,,,,,,,,,,,,,,,,,,,
Eclipse Muto,,https://projects.eclipse.org/projects/automotive.muto,logos/c52d3ca98bc70e52625611c9c3f27e7e3350eba9705265e1bc91338d8db8b089.png,,,,,Incubating,,,,"Eclipse Muto provides an adaptive framework and a runtime platform for dynamically composable model-driven ROS software stacks. Eclipse Muto can be used  to introspect, monitor and manipulate the...",,,,,,,,,,,,Example Applications,Example Applications,,,,,,,,,,,,,,,,,,,,,,,,
Eclipse Open Vehicle API,,https://projects.eclipse.org/projects/automotive.openvehicle-api,logos/28deae44070293ea34bf79cf45a53bef0e3d4298a089474bdb2616721341ac9d.jpg,,,,,Incubating,,,,"The Eclipse Open Vehicle API contains tools and a runtime to create a vehicle abstraction interface for signal- and event-driven functions. 

Component-based
Transfer existing signal-based ECUs to HPC...",,,,,,,,,,,,Tooling Devops,Development,,,,,,,,,,,,,,,,,,,,,,,,
Eclipse OpenBSW,,https://projects.eclipse.org/projects/automotive.openbsw,logos/14738f70197e197d29160180e7340a4d992966689c34c71d272d812d336b7024.png,,,,,Incubating,,,,The project provides an embedded basic software (BSW) stack for microcontrollers written in C++ (language features up to C++14 are used). It provides libraries forlifecycle (startup/shutdown...,,,,,,,,,,,,Distributions and Frameworks,Distributions,,,,,,,,,,,,,,,,,,,,,,,,
Eclipse openDuT,,https://projects.eclipse.org/projects/automotive.opendut,logos/6314d57c0f62aa39f9b215531e621abbb60a6c8e59c32cf508765b633abf22db.png,,,,,Incubating,,,,Eclipse openDuT automates the testing and validation process for automotive software and applications. This includes offering a framework for the testing and validation process but also includes...,,,,,,,,,,,,Tooling Devops,Testing & Validation,,,,,,,,,,,,,,,,,,,,,,,,
Eclipse OpenSOVD,,https://projects.eclipse.org/projects/automotive.opensovd,logos/14738f70197e197d29160180e7340a4d992966689c34c71d272d812d336b7024.png,,,,,Incubating,,,,"Eclipse OpenSOVD provides an open source implementation of the Service-Oriented Vehicle Diagnostics (SOVD) standard, as defined in ISO 17978. The project delivers a modular, standards-compliant...",,,,,,,,,,,,Service Fabric and Communication,Service Mesh,,,,,,,,,,,,,,,,,,,,,,,,
Eclipse OpenXilEnv,,https://projects.eclipse.org/projects/automotive.openxilenv,logos/14738f70197e197d29160180e7340a4d992966689c34c71d272d812d336b7024.png,,,,,Incubating,,,,"Eclipse OpenXilEnv is a lightweight SIL/HIL environment that allows running embedded software functions on a PC without a target platform and compiler.
Eclipse OpenXilEnv will provide a configurable...",,,,,,,,,,,,Tooling Devops,Testing & Validation,,,,,,,,,,,,,,,,,,,,,,,,
Eclipse p3com,,https://projects.eclipse.org/projects/automotive.p3com,logos/14738f70197e197d29160180e7340a4d992966689c34c71d272d812d336b7024.png,,,,,Incubating,,,,"Eclipse p3com enables arbitrary communication interfaces through a convenient and modern high level API while exploiting full HW capabilities.
Eclipse ""p3com"" stands for:

Pluggable
Portable
Publish...",,,,,,,,,,,,Service Fabric and Communication,Middleware & Frameworks,,,,,,,,,,,,,,,,,,,,,,,,
Eclipse Pullpiri,,https://projects.eclipse.org/projects/automotive.pullpiri,logos/cdb4ce096a287c998f2c93d1f6263257b0c62a88405833962d9a74b764e1550e.png,,,,,Incubating,,,,"Pullpiri is an open‑source orchestration platform optimized for in‑vehicle environments. Based on the K8S orchestration model, it has been redesigned for the unique constraints of automotive systems.",,,,,,,,,,,,Runtime and Orchestration,Workload & Container Orchestration,,,,,,,,,,,,,,,,,,,,,,,,
Eclipse Safe Open Vehicle Core,,https://projects.eclipse.org/projects/automotive.score,logos/a4aad33b306f3b1f31f564427482d8deec7875066e021b4b2f71919737c0cbf0.png,,,,,Incubating,,,,"The Eclipse Safe Open Vehicle Core project aims to develop an open-source core stack for Software Defined Vehicles (SDVs), specifically targeting embedded high-performance Electronic Control Units...",,,,,,,,,,,,Distributions and Frameworks,Distributions,,,,,,,,,,,,,,,,,,,,,,,,
Eclipse SDV Blueprints,,https://projects.eclipse.org/projects/automotive.sdv-blueprints,logos/2eab00974da0c48d89f11b6f475b5275c09d5dba27bc5c0f8cc5365ffc5566f3.png,,,,,Incubating,,,,The Eclipse SDV Blueprints project hosts different blueprints of how to apply technologies developed in the scope of the projects of the Eclipse SDV working group (sdv.eclipse.org). This makes it...,,,,,,,,,,,,Distributions and Frameworks,Distributions,,,,,,,,,,,,,,,,,,,,,,,,
Eclipse SDV Developer Console,,https://projects.eclipse.org/projects/automotive.dco,logos/14738f70197e197d29160180e7340a4d992966689c34c71d272d812d336b7024.png,,,,,Incubating,,,,Eclipse SDV Developer Console (DCO) integrates necessary sources for software lifecycle management and there by optimizes the complete process from development to release of software. The core of DCO...,,,,,,,,,,,,Tooling Devops,Development,,,,,,,,,,,,,,,,,,,,,,,,
Eclipse SDV-LVL ,,https://projects.eclipse.org/projects/automotive.sdv-lvl,logos/14738f70197e197d29160180e7340a4d992966689c34c71d272d812d336b7024.png,,,,,Incubating,,,,"Just as the SAE Levels of Autonomy helped to level-set discussion on autonomous driving, the Eclipse SDV-LVL defines a common terminology/taxonomy for capabilities of SDV. In the field of highly...",,,,,,,,,,,,Unmapped,Misc,,,,,,,,,,,,,,,,,,,,,,,,
Eclipse SommR,,https://projects.eclipse.org/projects/automotive.sommr,logos/659e2f70be525eba2aab44801cf938957fba27e876a66937af6956f883dcbd24.png,,,,,Archived,,,,"Eclipse SommR provides an automotive grade implementation of the SomeIP specification for embedded Linux systems together with the required tools to support developers.
Eclipse SommR fosters...",,,,,,,,,,,,Unmapped,Misc,,,,,,,,,,,,,,,,,,,,,,,,
Eclipse Symphony,,https://projects.eclipse.org/projects/iot.symphony,logos/22517b879b489a8c3375dc0e5b370884f49aec278886830e2463f96d1845b198.png,,,,,Incubating,,,,"Eclipse Symphony enables end-to-end orchestration experience and addresses it as a distinct concern. Its objective is to provide an easy-to-adopt, cost-effective, and consistent application...",,,,,,,,,,,,Runtime and Orchestration,Workload & Container Orchestration,,,,,,,,,,,,,,,,,,,,,,,,
Eclipse ThreadX,,https://projects.eclipse.org/projects/iot.threadx,logos/7e5c4002fb4e6c935714a543937a60b2657eb23871e42e4d4b8b1330ddc231c8.png,,,,,Incubating,,,,"Eclipse ThreadX® provides a vendor-neutral, open source, safety certified OS for real-time applications published under a permissive license.
The Eclipse ThreadX suite encompasses:

ThreadX - advanced...",,,,,,,,,,,,RTOS,RTOS,,,,,,,,,,,,,,,,,,,,,,,,
Eclipse Trustable Software Framework,,https://projects.eclipse.org/projects/technology.tsf,logos/da3ae71bdda28a67bcb3334af7c3d88b13141aca85933f2128fe7ee8a6197ecc.png,,,,,Incubating,,,,"The focus of the Eclipse Trustable Software Framework project is practical approaches to understanding risks in software engineering. 
Describing and quantifying these risks requires a scalable...",,,,,,,,,,,,Tooling Devops,Process & Frameworks,,,,,,,,,,,,,,,,,,,,,,,,
Eclipse uProtocol,,https://projects.eclipse.org/projects/automotive.uprotocol,logos/77778a8efcd1a01d11c572343a6626683d5486bb828b0b26ec89b2bcaffc4d1b.png,,,,,Incubating,,,,"Eclipse uProtocol provides a transport agnostic, layered communication protocol that is deployment, OS, and device (vehicle, cloud, mobile phone, charging station, etc...) agnostic, leveraging well...",,,,,,,,,,,,Service Fabric and Communication,Service Mesh,,,,,,,,,,,,,,,,,,,,,,,,
Eclipse Velocitas,,https://projects.eclipse.org/projects/automotive.velocitas,logos/85a8d943ee97e0bc36c7894ec6b0923225aeb9fec313003532e4ecc3e30b5ffa.png,,,,,Incubating,,,,"Eclipse Velocitas™ provides an end-to-end, scalable, modular and open source development toolchain for creating containerized and non-containerized in-vehicle applications.
Currently, the automotive...",,,,,,,,,,,,Tooling Devops,Development,,,,,,,,,,,,,,,,,,,,,,,,
Eclipse Zenoh,,https://projects.eclipse.org/projects/iot.zenoh,logos/1c9e9c7e835e6a4c8787e68de573f21c991d7eb57fb4626890c1691eaba89e49.png,,,,,Incubating,,,,"Eclipse Zenoh provides is a stack  designed to (1) minimize network overhead, (2) support extremely constrained devices, (3) supports devices with low duty-cycle by allowing the negotiation of data...",,,,,,,,,,,,Service Fabric and Communication,Middleware & Frameworks,,,,,,,,,,,,,,,,,,,,,,,,
